input_text,target_text
"disappointment to disapproval: This was unsuccessful as Everton failed to generate the £30 million needed for a half stake in the stadium project, with the city council rejecting the proposal in 2003.","The city council rejected Everton's proposal for a 50% stake in the stadium project in 2003, citing the club's inability to generate the necessary £30 million."
"sadness to disappointment: Between June 2007 and November 2008, Americans lost an estimated average of more than a quarter of their collective net worth.","Between June 2007 and November 2008, Americans lost an estimated average of more than a quarter of their collective net worth."
"confusion to nervousness: With approximately 12,000 sport hunters applying for hunting licences in recent years (in a very small country of about the size of the state of Delaware at about 5128 square kilometers and 1.3 million inhabitants), there is some concern that the practice might not be sustainable.","With approximately 12,000 sport hunters applying for hunting licences in recent years (in a very small country of about the size of the state of Delaware at about 5128 square kilometers and 1.3 million inhabitants), there is some concern that the practice might not be sustainable."
"admiration to approval: Each szlachcic had enormous influence over the country's politics, in some ways even greater than that enjoyed by the citizens of modern democratic countries.","Each szlachcic had enormous influence over the country's politics, in some ways even greater than that enjoyed by the citizens of modern democratic countries."
"realization to fear: However, with time, researchers noticed that the animals on the endangered species list still were not getting enough protection, thus further threatening their extinction.","The lack of adequate protection for animals on the endangered species list was observed by researchers over time, leading to an increased risk of extinction."
"optimism to approval: If the worst comes to the worst, priority should be given to the euro's stability.","If the worst comes to the worst, priority should be given to the euro's stability."
admiration to approval: He won Ottoman confidence as a junior officer in the Crimean War.,His junior officer role in the Crimean War led to him winning the confidence of the Ottoman Empire.
"approval to caring: Where the press is free, and every man able to read, all is safe.""","Where the press is free, and every man able to read, all is safe."""
"sadness to disappointment: Much of Europe, a continent that had dominated the world for several centuries, was in ruins, and host to the armies of the United States and the Soviet Union, who now held the balance of global power.","The continent of Europe, once a powerful force in the world, was now in ruins and under the control of the United States and the Soviet Union, who had taken over as the world's leading powers."
"disappointment to disapproval: In spite of influential supporters among the English aristocracy, such as John of Gaunt, the movement was not allowed to survive.","The movement was not permitted to survive, despite having influential supporters in the English aristocracy, such as John of Gaunt."
"admiration to approval: The issue was a great success, with it and a second printing the following month selling, combined, nearly 900,000 copies.","The topic was a resounding success, with sales of almost 900,000 copies from the first and second printings in the following month."
