input_text,target_text
"sadness to disappointment: Relative to the size of its economy, Iceland’s banking collapse is the largest suffered by any country in economic history.","Iceland's banking collapse is the largest ever experienced by any country, considering the size of its economy."
"admiration to approval: Plastics offer better stability and ageing performance, which makes them useful in timer circuits, although they may be limited to low operating temperatures and frequencies.","Plastics offer better stability and ageing performance, which makes them useful in timer circuits, although they may be limited to low operating temperatures and frequencies."
disappointment to disapproval: Such a plan (which was defeated in Congress) would have seriously undermined the judiciary's independence and power.,Such a plan (which was defeated in Congress) would have seriously undermined the judiciary's independence and power.
gratitude to approval: Programs such as the International Baccalaureate have contributed to the internationalization of education.,Programs such as the International Baccalaureate have contributed to the internationalization of education.
"sadness to disappointment: In the Carboniferous, rainforest collapse led to a great loss of plant and animal life.",The collapse of rainforests in the Carboniferous era caused a significant decrease in plant and animal populations.
"approval to disappointment: A majority of 59% have a positive view of the country, while 14% have a negative view.","59% of the population has a good impression of the country, while 14% have a bad impression."
"excitement to approval: Following the end of the Maoist insurgency, there was a significant rise of 509,956 tourist arrivals in 2009.","Following the end of the Maoist insurgency, there was a significant rise of 509,956 tourist arrivals in 2009."
"admiration to approval: Skiing, snowboarding and mountaineering are among the most popular sports in Switzerland, the nature of the country being particularly suited for such activities.","Skiing, snowboarding and mountaineering are among the most popular sports in Switzerland, the nature of the country being particularly suited for such activities."
"approval to caring: Therefore, it is important to get the proper amount of sleep so that memory can function at the highest level.","Therefore, it is important to get the proper amount of sleep so that memory can function at the highest level."
"sadness to disappointment: Socioeconomic factors, in combination with early but enduring views of race, have led to considerable suffering within disadvantaged racial groups.","The lasting racial attitudes, in conjunction with socioeconomic factors, have led to significant adversity among disadvantaged racial groups."
fear to nervousness: Especially states with a fragile political system have to fear that investors from Western states withdraw their money because of the crisis.,The possibility of Western investors pulling out their investments due to the crisis is a significant concern for states with a fragile political system.
disgust to disappointment: Prognosis is worse if a mechanical complication such as papillary muscle or myocardial free wall rupture occurs.,A mechanical complication such as a rupture in the papillary muscle or myocardial free wall can lead to a worse prognosis.
realization to disapproval: Some theories popular from the 1950s to 2011 incorrectly stated that inequality had a positive effect on economic development.,Some theories popular from the 1950s to 2011 incorrectly stated that inequality had a positive effect on economic development.
disappointment to disapproval: Analyses based on comparing yearly equality figures to yearly growth rates were misleading because it takes several years for effects to manifest as changes to economic growth.,The comparison of yearly equality figures to yearly growth rates for analysis is flawed as it takes a few years for changes in economic growth to materialize.
admiration to approval: Southampton is a major UK port which has good transport links with the rest of the country.,"Southampton, a major port in the UK, has reliable transport connections to the rest of the nation."
"surprise to disappointment: They lifted the FA Cup with a shock victory over Manchester United in 1976, returned to the top flight two years later, and stayed there for 27 years (becoming founder members of the Premier League in 1992) before they were relegated in 2005.","They lifted the FA Cup with a shock victory over Manchester United in 1976, returned to the top flight two years later, and stayed there for 27 years (becoming founder members of the Premier League in 1992) before they were relegated in 2005."
"admiration to approval: Southern California is famous for tourism and Hollywood (film, television, and music).","Southern California is popular for its tourism and the entertainment industry, which includes film, television, and music."
"admiration to disapproval: Spectre received mixed reviews upon its release; although criticised for its length, lack of screen time for new characters, and writing, it received praise for its action sequences and cinematography.","The release of Spectre resulted in mixed reviews, with some praising its action sequences and cinematography, while others criticized its length, lack of screen time for new characters, and writing."
"admiration to disappointment: The theme song, ""Writing's on the Wall"", received mixed reviews, particularly compared to the previous theme; nevertheless, it won the Golden Globe for Best Original Song and was nominated for the Academy Award in the same category.","The theme song ""Writing's on the Wall"" was not universally praised, but it still managed to win the Golden Globe for Best Original Song and receive an Academy Award nomination in the same category, despite being compared unfavorably to the previous theme."
"admiration to approval: The film received strong reviews with the review tallying website Rotten Tomatoes giving it a 92% approval rating, reporting that 206 out of the 225 reviews they tallied were positive.","Rotten Tomatoes gave the film a 92% approval rating, based on 206 positive reviews out of 225 total reviews."
"admiration to approval: Nowadays, Strasbourg is known to offer among the best university courses in France, after Paris.","Nowadays, Strasbourg is known to offer among the best university courses in France, after Paris."
admiration to approval: Their development of deductive reasoning was of particular importance and usefulness to later scientific inquiry.,The progress they made in deductive reasoning was particularly important and useful for scientific investigations in the future.
"joy to admiration: Surrounded by the Yangtze River and mountains, Nanjing also enjoys beautiful natural scenery.",The natural beauty of Nanjing is enhanced by the Yangtze River and mountains that surround it.
"admiration to approval: Although the site is considered Buddhist, it is revered by both Buddhists and Hindus.","Although the site is considered Buddhist, it is revered by both Buddhists and Hindus."
"admiration to approval: Technology magazine T3 gave the Super Slim model a positive review, stating the console is almost ""nostalgic"" in the design similarities to the original ""fat"" model, ""While we don’t know whether it will play PS3 games or Blu-ray discs any differently yet, the look and feel of the new PS3 Slim is an obvious homage to the original PS3, minus the considerable excess weight.","Technology magazine T3 gave the Super Slim model a positive review, stating the console is almost ""nostalgic"" in the design similarities to the original ""fat"" model, ""While we don’t know whether it will play PS3 games or Blu-ray discs any differently yet, the look and feel of the new PS3 Slim is an obvious homage to the original PS3, minus the considerable excess weight."
"caring to nervousness: Immediately we would be concerned about the durability of the top loading tray that feels like it could be yanked straight out off the console, but ultimately it all feels like Sony's nostalgic way of signing off the current generation console in anticipation for the PS4.""","The top loading tray's durability is a worry, but it seems like Sony is using it as a sentimental way to wrap up the current console generation in anticipation of the PS4."
"admiration to approval: Tennessee has played a critical role in the development of many forms of American popular music, including rock and roll, blues, country, and rockabilly.","Tennessee has played a critical role in the development of many forms of American popular music, including rock and roll, blues, country, and rockabilly."
"joy to disappointment: With new signings like Malcolm Macdonald and Pat Jennings, and a crop of talent in the side such as Liam Brady and Frank Stapleton, the club enjoyed their best form since the 1971 double, reaching a trio of FA Cup finals (1978, 1979 and 1980), and losing the 1980 European Cup Winners' Cup Final on penalties.","With the addition of players like Malcolm Macdonald and Pat Jennings, and a strong group of players like Liam Brady and Frank Stapleton already on the team, the club experienced their most successful period since the 1971 double, making it to three FA Cup finals (1978, 1979, and 1980) and narrowly missing out on the 1980 European Cup Winners' Cup Final."
admiration to approval: It is culturally diverse and also includes significant Mexican-American and Asian-American (principally Hmong or Laotian) populations.,It is culturally diverse and also includes significant Mexican-American and Asian-American (principally Hmong or Laotian) populations.
"approval to realization: With increasing industrialisation, London's population grew rapidly throughout the 19th and early 20th centuries, and it was for some time in the late 19th and early 20th centuries the most populous city in the world.","With increasing industrialisation, London's population grew rapidly throughout the 19th and early 20th centuries, and it was for some time in the late 19th and early 20th centuries the most populous city in the world."
admiration to disappointment: Their work was admired by contemporaries but was totally destroyed in later centuries except two fragments depicting greyhounds (now in the Monte Cassino Museum).,"Despite being admired by their contemporaries, their work was destroyed in later centuries, with only two fragments depicting greyhounds surviving and now being displayed at the Monte Cassino Museum."
admiration to approval: The Alpine region has a strong cultural identity.,The cultural identity of the Alpine region is deeply ingrained.
"surprise to disappointment: The aim is surprisingly, astonishingly, amazingly inaccurate ...",The purpose is amazingly flawed...
"fear to disappointment: The mountain top removal method of coal mining, in which entire mountain tops are removed, is currently threatening vast areas and ecosystems of the Appalachian Mountain region.","The mountain top removal method of coal mining, in which entire mountain tops are removed, is currently threatening vast areas and ecosystems of the Appalachian Mountain region."
sadness to disappointment: The struggles with Rome had left Greece depopulated and demoralised.,The battles with Rome had caused Greece to become depopulated and demoralized.
"gratitude to admiration: As well as being a broadcaster, the corporation also produces a large number of its own programmes in-house, thereby ranking as one of the world's largest television production companies.","As well as being a broadcaster, the corporation also produces a large number of its own programmes in-house, thereby ranking as one of the world's largest television production companies."
"approval to realization: After decades in which urban populations had been underrepresented in many state legislatures, this significant ruling led to an increased (and proportional) prominence in state politics by urban and, eventually, suburban, legislators and statewide officeholders in relation to their population within the state.","For decades, urban populations were not adequately represented in state legislatures, but this ruling changed that by increasing the prominence of urban and suburban legislators and statewide officeholders in relation to their population within the state."
"sadness to disappointment: They were unsuccessful; the result was 180 dead, wounded, or taken prisoner.","They were unsuccessful; the result was 180 dead, wounded, or taken prisoner."
"admiration to disappointment: The Boulton Paul Defiant, despite its poor performance during daylight engagements, was a much better night fighter.","The Boulton Paul Defiant's daytime engagements were disappointing, but it was a superior fighter at night."
"sadness to disappointment: It is this unfortunate distinction that has led to the club often being known as ""The Lovable Losers.""","The club's reputation for losing has led to it being commonly known as ""The Lovable Losers."""
"gratitude to admiration: Established in 1955, it is regarded as one of the best high schools in the country, blending a rigorous curriculum with strong extracurricular activities.","Established in 1955, it is regarded as one of the best high schools in the country, blending a rigorous curriculum with strong extracurricular activities."
"sadness to disappointment: The Crimean War marks the demise of the Concert of Europe, the balance of power that had dominated Europe since the Congress of Vienna in 1815, and which had included France, Russia, Austria and the United Kingdom.","The Crimean War brought about the end of the Concert of Europe, the power balance that had dominated Europe since the Congress of Vienna in 1815, and which had included France, Russia, Austria, and the United Kingdom."
"excitement to admiration: The team recorded their 10,000th win in April, while establishing an early division lead.","The team reached their 10,000th win in April and gained an early lead in their division."
"confusion to disapproval: There is no consensus amongst theorists and historians on a definition of comics; some emphasize the combination of images and text, some sequentiality or other image relations, and others historical aspects such as mass reproduction or the use of recurring characters.","There is no consensus amongst theorists and historians on a definition of comics; some emphasize the combination of images and text, some sequentiality or other image relations, and others historical aspects such as mass reproduction or the use of recurring characters."
admiration to approval: It resulted from powerful preaching that gave listeners a sense of deep personal revelation of their need of salvation by Jesus Christ.,It resulted from powerful preaching that gave listeners a sense of deep personal revelation of their need of salvation by Jesus Christ.
"admiration to approval: Iraklis have also seen significant success in European competitions, having been three times runners-up of the CEV Champions League.","Iraklis have also seen significant success in European competitions, having been three times runners-up of the CEV Champions League."
"admiration to approval: According to the American Library Association, this makes it the largest academic library in the United States, and one of the largest in the world.",The American Library Association confirms that this library is the largest academic library in the US and one of the largest globally.
"admiration to approval: At this time, Greek cultural influence and power was at its peak in Europe, Africa and Asia, experiencing prosperity and progress in the arts, exploration, literature, theatre, architecture, music, mathematics, philosophy, and science.","At this time, Greek cultural influence and power was at its peak in Europe, Africa and Asia, experiencing prosperity and progress in the arts, exploration, literature, theatre, architecture, music, mathematics, philosophy, and science."
"gratitude to approval: Unlike most places, high oil and gasoline prices are beneficial for Houston's economy, as many of its residents are employed in the energy industry.","Unlike most places, high oil and gasoline prices are beneficial for Houston's economy, as many of its residents are employed in the energy industry."
"confusion to disapproval: The underlying linear model of policy-making of more knowledge we have, the better the political response will be is being doubted.","The underlying linear model of policy-making of more knowledge we have, the better the political response will be is being doubted."
"caring to nervousness: As the pace of development accelerates and populations continue to expand in Southeast Asia, concern has increased regarding the impact of human activity on the region's environment.","As the pace of development accelerates and populations continue to expand in Southeast Asia, concern has increased regarding the impact of human activity on the region's environment."
"approval to realization: The nations of the region, with only few exceptions, have become aware of the need to maintain forest cover not only to prevent soil erosion but to preserve the diversity of flora and fauna.","The nations of the region, with only few exceptions, have become aware of the need to maintain forest cover not only to prevent soil erosion but to preserve the diversity of flora and fauna."
"admiration to approval: The tour has received positive critical reception, but featured controversial subjects such as violence, firearms, human rights, nudity and politics.","The tour has received positive critical reception, but featured controversial subjects such as violence, firearms, human rights, nudity and politics."
"approval to realization: In the mid-19th century, Marxism was developed, and socialism in general gained increasing popular support, mostly from the urban working class.","The mid-19th century saw the emergence of Marxism and the increasing popularity of socialism, particularly among the urban working class."
"confusion to surprise: The sudden apparent ""outlawing"" of the 400-year-old Mass, the last typical edition of which being promulgated only a few years earlier in 1962 by Paul's predecessor, Pope John XXIII, was not always explained well.","The unexpected seeming prohibition of the 400-year-old Mass, which had been authorized by Pope John XXIII in 1962, was not always properly explained."
"sadness to disappointment: This ended the so-called ""heroic"" epoch of Swiss history.","This ended the so-called ""heroic"" epoch of Swiss history."
"admiration to approval: The PlayStation 3 Slim received extremely positive reviews as well as a boost in sales; less than 24 hours after its announcement, PS3 Slim took the number-one bestseller spot on Amazon.com in the video games section for fifteen consecutive days.","After receiving rave reviews and a sales boost, the PS3 Slim quickly became the top-selling video game item on Amazon.com for 15 consecutive days, less than 24 hours after its announcement."
admiration to approval: Thus a cultural climate was created that greatly enhanced the development of the humanities and the sciences.,Thus a cultural climate was created that greatly enhanced the development of the humanities and the sciences.
"joy to admiration: You are the glory of Jerusalem, you are the joy of Israel, you give honour to our people.","You are the glory of Jerusalem, you are the joy of Israel, you give honour to our people."
"sadness to disappointment: The persistent drought around 850 AD coincided with the collapse of Classic Maya civilization, and the famine of One Rabbit (AD 1454) was a major catastrophe in Mexico.","The persistent drought around 850 AD coincided with the collapse of Classic Maya civilization, and the famine of One Rabbit (AD 1454) was a major catastrophe in Mexico."
"confusion to disapproval: Some authors have proposed that there may be evidence of a sub-stratum or add-stratum language for geographic features and various crafts and agricultural activities, called variously Proto-Euphratean or Proto Tigrean, but this is disputed by others.","Some authors have proposed that there may be evidence of a sub-stratum or add-stratum language for geographic features and various crafts and agricultural activities, called variously Proto-Euphratean or Proto Tigrean, but this is disputed by others."
"excitement to joy: and became expansive and sang with joy!""","and became expansive and sang with joy!"""
admiration to approval: The Super Slim model of PS3 has received positive reviews.,The Super Slim PS3 has garnered positive feedback from reviewers.
"admiration to desire: The Sustainable Development Goals are ambitious, and they will require enormous efforts across countries, continents, industries and disciplines - but they are achievable.","The Sustainable Development Goals are ambitious, and they will require enormous efforts across countries, continents, industries and disciplines - but they are achievable."
"realization to disappointment: Worst of all, before the war, an uninformed US Customs officer had seized a copy of the Japanese merchant marine code (called the ""maru code"" in the USN), not knowing that the Office of Naval Intelligence (ONI) had broken it.","Worst of all, before the war, an uninformed US Customs officer had seized a copy of the Japanese merchant marine code (called the ""maru code"" in the USN), not knowing that the Office of Naval Intelligence (ONI) had broken it."
confusion to disapproval: National census results in the past few decades have been disputed.,National census results in the past few decades have been disputed.
"optimism to approval: More generally, parties with a broad base of support across regions or among economic and other interest groups, have a great chance of winning the necessary plurality in the U.S.'s largely single-member district, winner-take-all elections.","Parties that have a wide-ranging support base across regions or economic and other interest groups have a greater chance of winning the necessary plurality in the U.S.'s single-member district, winner-take-all elections."
"admiration to approval: The eleven-day mission was a total success, as the spacecraft performed a virtually flawless mission, paving the way for the United States to continue with its lunar mission schedule.","The success of the eleven-day mission was guaranteed by the spacecraft's nearly flawless performance, allowing the United States to continue with its lunar mission schedule."
"joy to approval: This was a long period of prosperity for the British people, as profits gained from the overseas British Empire, as well as from industrial improvements at home, allowed a large, educated middle class to develop.","A long period of prosperity for the British people was made possible by the profits obtained from the British Empire overseas and the advancements in industry at home, which fostered the growth of a substantial, educated middle class."
"sadness to disappointment: China's income fell sharply during the wars as vast areas of farmland were destroyed, millions of lives were lost, and countless armies were raised and equipped to fight the rebels.","China's income plummeted during the wars due to the destruction of farmland, loss of millions of lives, and the mobilization of armies to combat the rebels."
admiration to approval: This group is in the best position to absorb the economic shocks.,This group is in the best position to absorb the economic shocks.
"approval to caring: A recent inspection indicated that the damage was less severe than initially feared, and it remains structurally stable and safe.","According to a recent inspection, the damage was not as severe as initially feared, and the structure remains stable and safe."
"joy to approval: I am satisfied, that within a few years there has been a great Change in the National Character.","I am satisfied, that within a few years there has been a great Change in the National Character."
disappointment to disapproval: The air offensive against the RAF and British industry failed to have the desired effect.,The effort to damage the RAF and British industry through aerial bombardment was ineffective.
"admiration to approval: Commercially, the album peaked at number one in numerous countries and sold more than 16 million copies worldwide.","Commercially, the album peaked at number one in numerous countries and sold more than 16 million copies worldwide."
"gratitude to admiration: The area's many universities and colleges make Philadelphia a top international study destination, as the city has evolved into an educational and economic hub.","The area's many universities and colleges make Philadelphia a top international study destination, as the city has evolved into an educational and economic hub."
disappointment to disapproval: The baroque style had never truly been to the English taste.,The baroque style had never truly been to the English taste.
"admiration to approval: The book aroused international interest and a widespread debate, with no sharp line between scientific issues and ideological, social and religious implications.","The book aroused international interest and a widespread debate, with no sharp line between scientific issues and ideological, social and religious implications."
"admiration to approval: The movie was a hit at the box office, quickly grossing more than $20 million from a $2-million budget.","The movie quickly made a profit, grossing more than $20 million from a budget of $2 million."
